{
  "$schema": "https://json-schema.org/draft/2020-12/schema",
  "$id": "https://lotus-platform.local/platform-contracts/vulnerability-exceptions/vulnerability-exception-register.schema.json",
  "title": "Lotus Vulnerability Exception Register",
  "type": "object",
  "additionalProperties": false,
  "required": [
    "schema_version",
    "register_id",
    "repository",
    "generated_at_utc",
    "lane_posture",
    "exception_policy",
    "exceptions"
  ],
  "properties": {
    "schema_version": {
      "const": "lotus-platform.vulnerability-exception-register.v1"
    },
    "register_id": {
      "type": "string",
      "pattern": "^[a-z0-9][a-z0-9-]{5,96}$"
    },
    "repository": {
      "type": "string",
      "pattern": "^[A-Za-z0-9_.-]+/[A-Za-z0-9_.-]+$"
    },
    "generated_at_utc": {
      "type": "string",
      "format": "date-time"
    },
    "lane_posture": {
      "type": "string",
      "enum": [
        "report_only",
        "blocking_candidate",
        "blocking"
      ]
    },
    "exception_policy": {
      "$ref": "#/$defs/exceptionPolicy"
    },
    "exceptions": {
      "type": "array",
      "items": {
        "$ref": "#/$defs/exception"
      }
    }
  },
  "$defs": {
    "exceptionPolicy": {
      "type": "object",
      "additionalProperties": false,
      "required": [
        "false_positive_policy",
        "lane_placement",
        "promotion_requirement"
      ],
      "properties": {
        "false_positive_policy": {
          "type": "string",
          "minLength": 40
        },
        "lane_placement": {
          "type": "string",
          "minLength": 40
        },
        "promotion_requirement": {
          "type": "string",
          "minLength": 40
        }
      }
    },
    "exception": {
      "type": "object",
      "additionalProperties": false,
      "required": [
        "exception_id",
        "status",
        "component",
        "vulnerability",
        "exposure",
        "owner",
        "business_reason",
        "compensating_controls",
        "rollback_path",
        "expiry_date",
        "planned_fix",
        "approval",
        "evidence_refs",
        "removal_proof_ref"
      ],
      "properties": {
        "exception_id": {
          "type": "string",
          "pattern": "^VX-[A-Z0-9][A-Z0-9-]{5,80}$"
        },
        "status": {
          "type": "string",
          "enum": [
            "proposed",
            "approved",
            "expired",
            "remediated"
          ]
        },
        "component": {
          "$ref": "#/$defs/component"
        },
        "vulnerability": {
          "$ref": "#/$defs/vulnerability"
        },
        "exposure": {
          "$ref": "#/$defs/exposure"
        },
        "owner": {
          "$ref": "#/$defs/owner"
        },
        "business_reason": {
          "type": "string",
          "minLength": 40
        },
        "compensating_controls": {
          "type": "array",
          "minItems": 1,
          "items": {
            "type": "string",
            "minLength": 30
          }
        },
        "rollback_path": {
          "type": "string",
          "minLength": 40
        },
        "expiry_date": {
          "type": "string",
          "pattern": "^20[0-9]{2}-[0-9]{2}-[0-9]{2}$"
        },
        "planned_fix": {
          "$ref": "#/$defs/plannedFix"
        },
        "approval": {
          "type": [
            "object",
            "null"
          ],
          "additionalProperties": false,
          "required": [
            "approver",
            "approved_at_utc",
            "approval_ref"
          ],
          "properties": {
            "approver": {
              "type": "string",
              "minLength": 3
            },
            "approved_at_utc": {
              "type": "string",
              "format": "date-time"
            },
            "approval_ref": {
              "type": "string",
              "minLength": 20
            }
          }
        },
        "evidence_refs": {
          "type": "array",
          "minItems": 1,
          "items": {
            "$ref": "#/$defs/evidenceRef"
          }
        },
        "removal_proof_ref": {
          "type": [
            "string",
            "null"
          ],
          "minLength": 20
        }
      }
    },
    "component": {
      "type": "object",
      "additionalProperties": false,
      "required": [
        "type",
        "package_manager",
        "package_name",
        "version",
        "image_ref",
        "image_digest",
        "layer_digest",
        "build_artifact"
      ],
      "properties": {
        "type": {
          "type": "string",
          "enum": [
            "dependency",
            "container_image",
            "container_layer"
          ]
        },
        "package_manager": {
          "type": [
            "string",
            "null"
          ],
          "minLength": 2
        },
        "package_name": {
          "type": [
            "string",
            "null"
          ],
          "minLength": 2
        },
        "version": {
          "type": [
            "string",
            "null"
          ],
          "minLength": 1
        },
        "image_ref": {
          "type": [
            "string",
            "null"
          ],
          "minLength": 10
        },
        "image_digest": {
          "type": [
            "string",
            "null"
          ],
          "pattern": "^sha256:[a-fA-F0-9]{64}$"
        },
        "layer_digest": {
          "type": [
            "string",
            "null"
          ],
          "pattern": "^sha256:[a-fA-F0-9]{64}$"
        },
        "build_artifact": {
          "type": [
            "string",
            "null"
          ],
          "minLength": 3
        }
      }
    },
    "vulnerability": {
      "type": "object",
      "additionalProperties": false,
      "required": [
        "ids",
        "severity",
        "known_exploited",
        "scanner",
        "scan_ref",
        "scanner_available",
        "scanner_unavailable_issue"
      ],
      "properties": {
        "ids": {
          "type": "array",
          "minItems": 1,
          "uniqueItems": true,
          "items": {
            "type": "string",
            "pattern": "^(CVE-[0-9]{4}-[0-9]{4,}|GHSA-[a-z0-9]{4}-[a-z0-9]{4}-[a-z0-9]{4}|OSV-[A-Z0-9-]+)$"
          }
        },
        "severity": {
          "type": "string",
          "enum": [
            "low",
            "medium",
            "high",
            "critical"
          ]
        },
        "known_exploited": {
          "type": "boolean"
        },
        "scanner": {
          "type": "string",
          "minLength": 2
        },
        "scan_ref": {
          "type": "string",
          "minLength": 20
        },
        "scanner_available": {
          "type": "boolean"
        },
        "scanner_unavailable_issue": {
          "type": [
            "string",
            "null"
          ],
          "minLength": 20
        }
      }
    },
    "exposure": {
      "type": "object",
      "additionalProperties": false,
      "required": [
        "runtime_exposure",
        "exploitability",
        "assessment_ref"
      ],
      "properties": {
        "runtime_exposure": {
          "type": "string",
          "enum": [
            "none",
            "not_reachable",
            "internal_only",
            "external",
            "unknown"
          ]
        },
        "exploitability": {
          "type": "string",
          "enum": [
            "no_known_path",
            "proof_of_concept_only",
            "weaponized",
            "known_exploited",
            "unknown"
          ]
        },
        "assessment_ref": {
          "type": "string",
          "minLength": 20
        }
      }
    },
    "owner": {
      "type": "object",
      "additionalProperties": false,
      "required": [
        "team",
        "accountable",
        "github_issue"
      ],
      "properties": {
        "team": {
          "type": "string",
          "minLength": 3
        },
        "accountable": {
          "type": "string",
          "minLength": 2
        },
        "github_issue": {
          "type": "string",
          "pattern": "^https://github\\.com/[A-Za-z0-9_.-]+/[A-Za-z0-9_.-]+/issues/[0-9]+$"
        }
      }
    },
    "plannedFix": {
      "type": "object",
      "additionalProperties": false,
      "required": [
        "planned_action",
        "due_date",
        "target_version_or_digest",
        "remediation_ref"
      ],
      "properties": {
        "planned_action": {
          "type": "string",
          "minLength": 40
        },
        "due_date": {
          "type": "string",
          "pattern": "^20[0-9]{2}-[0-9]{2}-[0-9]{2}$"
        },
        "target_version_or_digest": {
          "type": "string",
          "minLength": 2
        },
        "remediation_ref": {
          "type": "string",
          "minLength": 20
        }
      }
    },
    "evidenceRef": {
      "type": "object",
      "additionalProperties": false,
      "required": [
        "type",
        "ref"
      ],
      "properties": {
        "type": {
          "type": "string",
          "enum": [
            "scanner",
            "release_evidence",
            "sbom",
            "risk_assessment",
            "remediation"
          ]
        },
        "ref": {
          "type": "string",
          "minLength": 20
        }
      }
    }
  }
}

