{
  "schema_version": "lotus-platform.vulnerability-exception-register.v1",
  "register_id": "lotus-platform-example-vulnerability-exceptions",
  "repository": "sgajbi/lotus-platform",
  "generated_at_utc": "2026-07-29T00:00:00Z",
  "lane_posture": "report_only",
  "exception_policy": {
    "false_positive_policy": "Scanner false positives must be issue-backed and time-bounded in this register; permanent scanner suppressions are not accepted as bank-buyable evidence.",
    "lane_placement": "Report-only until per-repository dependency and release-image baselines, false-positive handling, and focused validator tests are stable.",
    "promotion_requirement": "Promote to a blocking dependency/security or release-image lane only after current findings are measured and the exception register is consumed by that lane."
  },
  "exceptions": [
    {
      "exception_id": "VX-PLATFORM-DEPENDENCY-001",
      "status": "approved",
      "component": {
        "type": "dependency",
        "package_manager": "pip",
        "package_name": "example-runtime-library",
        "version": "1.2.3",
        "image_ref": null,
        "image_digest": null,
        "layer_digest": null,
        "build_artifact": "requirements.lock"
      },
      "vulnerability": {
        "ids": [
          "CVE-2026-0001"
        ],
        "severity": "high",
        "known_exploited": false,
        "scanner": "pip-audit",
        "scan_ref": "github-actions://sgajbi/lotus-platform/actions/runs/30420811630",
        "scanner_available": true,
        "scanner_unavailable_issue": null
      },
      "exposure": {
        "runtime_exposure": "not_reachable",
        "exploitability": "no_known_path",
        "assessment_ref": "https://github.com/sgajbi/lotus-platform/issues/596"
      },
      "owner": {
        "team": "platform-engineering",
        "accountable": "sgajbi",
        "github_issue": "https://github.com/sgajbi/lotus-platform/issues/596"
      },
      "business_reason": "The affected transitive dependency is present in the governed lock graph but not reachable by the platform runtime path under validation.",
      "compensating_controls": [
        "Release claims must continue to cite scanner evidence and this time-bounded exception until the dependency is removed or upgraded."
      ],
      "rollback_path": "Rollback to the previous signed release artifact and remove the affected dependency from the next dependency refresh.",
      "expiry_date": "2026-09-30",
      "planned_fix": {
        "planned_action": "Upgrade or remove the affected package when the maintained patch version is available in the governed lock graph.",
        "due_date": "2026-09-15",
        "target_version_or_digest": "1.2.4",
        "remediation_ref": "https://github.com/sgajbi/lotus-platform/issues/596"
      },
      "approval": {
        "approver": "platform-security",
        "approved_at_utc": "2026-07-29T00:00:00Z",
        "approval_ref": "https://github.com/sgajbi/lotus-platform/issues/596"
      },
      "evidence_refs": [
        {
          "type": "scanner",
          "ref": "github-actions://sgajbi/lotus-platform/actions/runs/30420811630"
        }
      ],
      "removal_proof_ref": null
    },
    {
      "exception_id": "VX-PLATFORM-IMAGE-001",
      "status": "proposed",
      "component": {
        "type": "container_image",
        "package_manager": null,
        "package_name": null,
        "version": null,
        "image_ref": "ghcr.io/sgajbi/lotus-platform@example",
        "image_digest": "sha256:1111111111111111111111111111111111111111111111111111111111111111",
        "layer_digest": null,
        "build_artifact": "release-evidence.json"
      },
      "vulnerability": {
        "ids": [
          "CVE-2026-0002"
        ],
        "severity": "medium",
        "known_exploited": false,
        "scanner": "trivy",
        "scan_ref": "github-actions://sgajbi/lotus-platform/actions/runs/30420811630",
        "scanner_available": true,
        "scanner_unavailable_issue": null
      },
      "exposure": {
        "runtime_exposure": "internal_only",
        "exploitability": "proof_of_concept_only",
        "assessment_ref": "https://github.com/sgajbi/lotus-platform/issues/596"
      },
      "owner": {
        "team": "platform-engineering",
        "accountable": "sgajbi",
        "github_issue": "https://github.com/sgajbi/lotus-platform/issues/596"
      },
      "business_reason": "The image finding is retained for report-only baseline proof while the release-image lane consumes digest-pinned scan output.",
      "compensating_controls": [
        "The release image remains digest-pinned and cannot be promoted without scanner evidence attached to the release manifest."
      ],
      "rollback_path": "Revert deployment to the previous digest-pinned release image and rebuild through the governed CI release lane.",
      "expiry_date": "2026-09-30",
      "planned_fix": {
        "planned_action": "Refresh the base image through the governed release-image pipeline after the scanner baseline is reviewed.",
        "due_date": "2026-09-15",
        "target_version_or_digest": "sha256:2222222222222222222222222222222222222222222222222222222222222222",
        "remediation_ref": "https://github.com/sgajbi/lotus-platform/issues/596"
      },
      "approval": null,
      "evidence_refs": [
        {
          "type": "release_evidence",
          "ref": "github-actions://sgajbi/lotus-platform/actions/runs/30420811630"
        }
      ],
      "removal_proof_ref": null
    },
    {
      "exception_id": "VX-PLATFORM-LAYER-001",
      "status": "remediated",
      "component": {
        "type": "container_layer",
        "package_manager": null,
        "package_name": null,
        "version": null,
        "image_ref": "ghcr.io/sgajbi/lotus-platform@example",
        "image_digest": "sha256:3333333333333333333333333333333333333333333333333333333333333333",
        "layer_digest": "sha256:4444444444444444444444444444444444444444444444444444444444444444",
        "build_artifact": "release-evidence.json"
      },
      "vulnerability": {
        "ids": [
          "CVE-2026-0003"
        ],
        "severity": "low",
        "known_exploited": false,
        "scanner": "trivy",
        "scan_ref": "github-actions://sgajbi/lotus-platform/actions/runs/30420811630",
        "scanner_available": true,
        "scanner_unavailable_issue": null
      },
      "exposure": {
        "runtime_exposure": "none",
        "exploitability": "no_known_path",
        "assessment_ref": "https://github.com/sgajbi/lotus-platform/issues/596"
      },
      "owner": {
        "team": "platform-engineering",
        "accountable": "sgajbi",
        "github_issue": "https://github.com/sgajbi/lotus-platform/issues/596"
      },
      "business_reason": "The layer finding remains in the example register to demonstrate remediated exception closure evidence.",
      "compensating_controls": [
        "No promotion claim is made from this historical layer after remediation proof is recorded."
      ],
      "rollback_path": "Use the replacement digest-pinned image and prevent redeploying the remediated vulnerable layer digest.",
      "expiry_date": "2026-07-01",
      "planned_fix": {
        "planned_action": "Replace the affected layer through a CI-built image and record the clean scanner run.",
        "due_date": "2026-06-25",
        "target_version_or_digest": "sha256:5555555555555555555555555555555555555555555555555555555555555555",
        "remediation_ref": "https://github.com/sgajbi/lotus-platform/issues/596"
      },
      "approval": null,
      "evidence_refs": [
        {
          "type": "remediation",
          "ref": "github-actions://sgajbi/lotus-platform/actions/runs/30420811630"
        }
      ],
      "removal_proof_ref": "github-actions://sgajbi/lotus-platform/actions/runs/30420811630"
    }
  ]
}

